{
  "version": 0,
  "gameplay": {
    "base_attack_interval_ticks": 12,
    "base_movement_speed": 0.75,
    "movement_acceleration_seconds": 2.0,
    "movement_min_speed_factor": 0.6,
    "movement_direction_grace_seconds": 0.2,
    "minimum_monster_aggro_radius": 10,
    "ranged_retreat_min_melee_engagement_seconds": 2.0,
    "base_drop_rate_percent": 25,
    "boss_bonus_drop_rate_percent": 80,
    "boss_extra_drop_rate_percent": 35,
    "boss_loot_magic_find_bonus_percent": 50,
    "respec_cost_gold": 0,
    "bishop_respec_resource_item_def_id": "respec_badge",
    "bishop_respec_resource_count": 1,
    "bishop_revive_resource_item_def_id": "resurrection_badge",
    "bishop_revive_resource_count": 1,
    "item_upgrade_cost_gold": 100,
    "item_upgrade_cost_growth_per_level": 50,
    "item_upgrade_max_level": 0,
    "item_upgrade_success_chance_percent": 100,
    "item_upgrade_failure_curve": {
      "safe_target_level_max": 1,
      "level_anchors": [2, 10],
      "failure_chance_percent_anchors": [10, 75]
    },
    "item_upgrade_shard_success_bonus_percent_per_tier": 10,
    "item_upgrade_pity_failure_threshold": 2,
    "item_upgrade_resource_item_def_id": "upgrade_shard",
    "item_upgrade_resource_count": 1,
    "resource_loot_drops": {
      "monster_common_rare_chance_percent": 1,
      "monster_champion_chance_percent": 2,
      "monster_unique_chance_percent": 3,
      "boss_kill_chance_percent": 5,
      "chest_regular_chance_percent": 2,
      "chest_boss_chance_percent": 3,
      "pool": [
        { "item_def_id": "upgrade_shard", "weight": 1 },
        { "item_def_id": "renew_stone", "weight": 1 }
      ]
    },
    "badge_reward_rules": [
      { "resource_item_def_id": "upgrade_shard", "unlock_depth": 10, "base_chance_percent": 25, "chance_per_depth_percent": 1 },
      { "resource_item_def_id": "respec_badge", "unlock_depth": 20, "base_chance_percent": 25, "chance_per_depth_percent": 1 },
      { "resource_item_def_id": "stat_badge", "unlock_depth": 30, "base_chance_percent": 25, "chance_per_depth_percent": 1 },
      { "resource_item_def_id": "skill_badge", "unlock_depth": 40, "base_chance_percent": 25, "chance_per_depth_percent": 1 },
      { "resource_item_def_id": "resurrection_badge", "unlock_depth": 50, "base_chance_percent": 25, "chance_per_depth_percent": 1 }
    ],
    "mercenary_hire_cost_gold": 75,
    "quest_turn_in_item_def_id": "quest_leaf",
    "quest_turn_in_reward_gold": 25,
    "companion_assist_radius": 5.0,
    "companion_follow_distance": 1.1,
    "companion_follow_stop_radius": 1.6
  },
  "presentation_lod": {
    "min_live_monsters": 24,
    "distance_threshold": 14.0
  },
  "loot_labels": {
    "crowd_cull_min_loot": 12,
    "max_visible_labels": 8,
    "combat_radius": 10.0
  },
  "client_perf": {
    "reconciliation_backpressure_threshold": 1.5,
    "windup_marker_max_concurrent": 12,
    "projectile_visible_cap": 16,
    "delta_ui_sync_interval_ticks": 3,
    "delta_minimap_sync_interval_ticks": 2
  },
  "client_reconnect": {
    "initial_delay_s": 0.5,
    "max_delay_s": 8.0,
    "backoff_exponent": 2,
    "max_attempts": 8,
    "give_up_s": 45.0,
    "http_resume_after_ws_failures": 2
  }
}
